Unnamed: 0,answer,words
15,"국가암정보센터에 따르면 유방암은 진행 정도와 발생부위, 종양크기, 개인의 선호도 및 건강 상태 등에 따라 수술과 항암화학요법, 항호르몬요법, 방사선치료를 조합하여 시행함을 확인할 수 있었습니다. 하지만 대부분은 유방암수술 후 보조 항암화학요법을 시행하며, 그 이후 방사선치료 및 항호르몬요법 순서로 치료계획을 수립하여 진행합니다.","['국가암정보센터', '유방암', '진행', '정도', '발생부위', '종양크기', '개인', '선호도', '건강', '상태', '수술', '항암화학요법', '호르몬', '요법', '방사선치료', '조합', '시행', '확인', '대부분', '유방암수술', '보조', '항암화학요법', '시행', '이후', '방사선치료', '호르몬', '요법', '순서', '치료계획', '수립', '진행']"
24,환자에게 중요한 것은 올바른 식습관으로 몸에 좋은 음식을 균형 있게 섭취함으로써 체력을 든든하게 키워 수술과 항암화학요법 등 각종 치료를 잘 견뎌내는 일입니다. 유방암 환자에게 권고 되는 바람직한 식생활 습관은 다음과 같습니다.,"['환자', '중요', '식습관', '음식', '균형', '섭취', '체력', '수술', '항암화학요법', '각종', '치료', '유방암', '환자', '권고', '식생활', '습관', '다음']"
28,"유방암 진단 후 MRI를 추가적으로 촬영하는 이유가 궁금하시군요, 이에 대해서 설명드리겠습니다.","['유방암', '진단', '추가', '촬영', '이유', '설명']"
30,"질문내용으로 유추해보면 어머님의 왼쪽 등 통증은 유방암 진단 당시부터 이어져 온 통증이며, 항암 후 검사 중 뼈 스캔이 포함되어 있어 뼈 전이에 대한 일차적인 평가가 가능하다고 판단하여 추가 검사를 포함하지 않았을 가능성이 높아 보입니다. 일반적으로는 뼈 스캔 검사 결과에서 의심 소견이 보일 때 추가검사를 시행하게 됩니다.","['질문내용', '유추', '어머님', '왼쪽', '통증', '유방암', '진단', '당시', '통증', '항암', '검사', '스캔', '포함', '전이', '일차', '평가', '가능', '판단', '추가', '검사', '포함', '가능', '일반', '스캔', '검사', '결과', '의심', '소견', '추가', '검사', '시행']"
31,간혹 위와 같은 증상이 장기적으로 지속되는 경우도 있지만 대부분의 경우에는 항암이 끝나면 증상이 사라집니다. 유방암 치료를 위한 항암화학요법과 치매와의 관련성 여부는 현재까지 분명하게 나타난 바가 없으며 여전히 연구가 진행되고 있습니다. 항암화학요법 이후 인지 기능 저하 증상이 나타날 경우 완화할 수 있는 습관에는 다음과 같은 것들이 있습니다.,"['증상', '장기', '지속', '경우', '대부분', '경우', '항암', '증상', '유방암', '치료', '항암화학요법', '치매', '관련', '여부', '현재', '연구', '진행', '항암화학요법', '이후', '인지', '기능', '저하', '증상', '경우', '완화', '습관', '다음']"
59,"유방암수술 후 흔히 발생하는 부작용 중 림프부종이 있는데, 수술 후 림프계순환에 문제가 생겨 발생할 수 있습니다. 특히, 유방암수술 중 겨드랑이 림프절을 제거하게 되면 림프액의 순환을 방해하여 림프부종이 발생할 수도 있습니다.","['유방암수술', '발생', '부작용', '림프부종', '수술', '림프계순환', '문제', '발생', '유방암수술', '겨드랑이', '림프절', '제거', '림프액', '순환', '방해', '림프부종', '발생']"
67,"2. 유방암이 재발될 경우 처음 발견된 부위가 아닌 뼈, 폐, 뇌, 간 등에서 발견될 수 있으며 이는 조직검사를 통해 재발 또는 2차 암의 여부를 확인할 수 있습니다. 재발 위치에 따라서 다음과 같이 3가지 종류로 나눌 수 있습니다.","['유방암', '재발', '경우', '처음', '발견', '부위', '발견', '조직검사', '재발', '여부', '확인', '재발', '위치', '다음', '가지', '종류']"
87,"유방촬영술, 유방초음파, 조직검사로 암인지 여부를 확인할 수는 있지만 암으로 진단된 후 치료계획을 세우기 위해서는 유방 MRI 촬영이 꼭 필요합니다. MRI는 강력한 자기장을 이용해 유방 내부의 사진을 찍는 검사 방법으로, 방사선이 아닌 자기장을 이용하기 때문에 몸에 해롭지 않고 부작용이 없습니다. 또한, 다양한 각도에서 사진을 찍기 때문에 보다 세밀한 촬영이 가능해요. 따라서 MRI 검사를 통해 유방 촬영술로 확인하지 못한 유방암의 정확한 위치와 크기를 확인할 수 있습니다. 구체적으로는 다음과 같은 경우 유방 MRI 촬영을 시행헤요","['유방촬영술', '유방초음파', '조직검사', '여부', '확인', '진단', '치료계획', '유방', '촬영', '필요', '자기장', '이용', '유방', '내부', '사진', '검사', '방법', '방사선', '자기장', '이용', '때문', '부작용', '다양', '각도', '사진', '때문', '촬영', '가능', '검사', '유방', '촬영술', '확인', '유방암', '정확', '위치', '크기', '확인', '구체', '다음', '경우', '유방', '촬영', '시행']"
90,"유방암수술 직후에는 담당 의사 선생님의 처방에 따라 병원에서 나오는 식이를 드시면 됩니다. 또, 수술 후 특별히 도움이 되는 음식은 따로 없지만, 전신 마취로 인해 소화 기능 및 연하 기능이 저하되었을 수 있으므로 소화가 힘들 경우 소화하기 편한 미음 또는 죽을 드시는 것을 권장 드립니다. 이후 소화 기능이 수술 전과 같이 돌아오게 되면, 식단과 관련하여 너무 엄격하게 관리하시느라 스트레스를 받으시기보다는 영양소의 종류와 구성을 잘 고려하여 드시는 것이 좋습니다. 국가암정보센터에서 권장하는 성인(암 환자 포함)의 바람직한 에너지원 구성은 1일 기준 지방 20 ~ 35%, 탄수화물 45 ~ 65%, 단백질 10 ~ 35%이며, 칼슘과 단백질 섭취의 중요성도 강조하고 있습니다.","['유방암수술', '직후', '담당', '의사', '선생', '처방', '병원', '식이', '수술', '도움', '음식', '전신', '마취', '소화', '기능', '연하', '기능', '저하', '소화', '경우', '소화', '미음', '권장', '이후', '소화', '기능', '수술', '식단', '관련', '관리', '스트레스', '영양소', '종류', '구성', '고려', '국가암정보센터', '권장', '성인', '환자', '포함', '에너지', '구성', '기준', '지방', '탄수화물', '단백질', '칼슘', '단백질', '섭취', '중요', '강조']"
100,"언급하신 내용을 고려하여 결론부터 말씀드리면, 현재 상황에서 캐싸일라 치료의 적용 대상은 아닌 것으로 사료됩니다.
『암환자에게 처방·투여하는 약제에 대한 요양급여의 적용기준 및 방법에 관한 세부 사항』에서  캐싸일라의 적용 기준은 ‘탁산 및 트라스투주맙 기반의 수술 전 선행 항암치료를 받은 후에도 침습적 잔존 병변이 있는 HER2 양성 조기 유방암 환자에서 수술 후 보조요법으로서 단독 투여’가 가능합니다. 2022.7.1부터 건강보험 적용이 되면서 해당 기준에 부합한 경우 급여 대상이 됩니다.","['언급', '내용', '고려', '결론', '말씀', '상황', '캐싸일라', '치료', '적용', '대상', '사료', '환자', '처방', '투여', '약제', '요양', '급여', '적용', '기준', '방법', '세부', '사항', '캐싸일라', '적용', '기준', '트라스투주맙', '기반', '수술', '선행', '항암치료', '침습', '잔존', '병변', '양성', '조기', '유방암', '환자', '수술', '보조', '요법', '단독', '투여', '가능', '건강', '보험', '적용', '해당', '기준', '부합', '경우', '급여', '대상']"
102,고세렐린(Goserelin)은 흔히 졸라덱스(Zoladex)라고도 불리며 주사기 안에 약물이 채워져 있는 형태로 피하주사를 통해 약물을 투약할 수 있습니다. 고세렐린은 폐경 전 유방암 환자의 난소에서 만들어지는 에스트로겐을 뇌의 호르몬 신호를 방해햐하여 항암제가 난소에 미치는 영향을 최소화하는 주사입니다. 고세렐린은 주사바늘이 두꺼운 편이기 때문에 몸에서 피하지방이 제일 많은 하복부에 4주(28일) 주기로 투약하게 되며 항암이 모두 끝날 때까지 투여하게 됩니다.,"['고세렐린', '졸라덱스', '주사기', '약물', '형태', '피하', '주사', '약물', '투약', '고세렐린', '폐경', '유방암', '환자', '난소', '에스트로겐', '호르몬', '신호', '방해햐', '항암제', '난소', '영향', '최소', '주사', '고세렐린', '주사', '바늘', '때문', '피하', '지방', '하복부', '투약', '항암', '투여']"
119,"미국유방암학회에 따르면 영양제는 종류가 매우 다양한 만큼 검증된 약물 여부가 다르고, 구성 성분에 따라 유방암 치료를 저해하거나 이미 투약하고 있는 약물과 상호작용하여 부작용 등을 야기할 수 있음을 말하고 있습니다. 따라서, 영양제를 복용하기 전 담당의사선생님께 먼저 말씀드리고 복용 여부를 확인받으시는 것이 중요합니다.","['미국유방암학회', '영양제', '종류', '다양', '만큼', '검증', '약물', '여부', '구성', '성분', '유방암', '치료', '저해', '투약', '약물', '상호', '작용', '부작용', '야기', '영양제', '복용', '담당의사선생님', '말씀', '복용', '여부', '확인', '중요']"
121,"폐경 전 에스트로겐 수용체양성인 유방암 환자에게 단독으로 투여하거나 선택적 에스트로겐수용체조절제, 아로마타제억제제와 함께 투여
              
폐경 후 항호르몬요법","['폐경', '에스트로겐', '수용체양성', '유방암', '환자', '단독', '투여', '선택', '에스트로겐수용체조절제', '아로마타제억제제', '투여', '폐경', '호르몬', '요법']"
130,"수술 후 운동을 해도 되는지 궁금하시군요. 수술 후 치료계획이 아직 확정되지 않으셨을 것 같으나, 수술 후 운동 시점과 함께 유방암의 치료과정에서 가능한 운동 및 시점에 대해서 전반적으로 설명드리겠습니다.","['수술', '운동', '수술', '치료계획', '확정', '수술', '운동', '시점', '유방암', '치료과정', '가능', '운동', '시점', '전반', '설명']"
149,"따라서, 유전성 유방암 고위험군에 해당하는 경우에는 검진센터나 유방외과 등에 방문하여 담당의사선생님과 상의해본 후, 필요한 경우 유전성 검사를 받아볼 수 있습니다. 고위험군에 해당하시는 경우 유전상담을 통해 구체적인 검진 주기와 관리 방법에 대해 설명을 듣고 따르는 것이 매우 중요합니다. 일반적으로 유방암 가족력이 있는 경우에는 30대부터 검진을 받는 것이 권고됩니다. 또한, 위험요인을 최소화하고 생활방식을 개선하는 것 또한 유방암 예방에 도움이 될 수 있습니다.","['유전', '유방암', '고위험군', '해당', '경우', '검진', '센터', '유방', '외과', '방문', '담당의사선생님', '상의', '필요', '경우', '유전', '검사', '고위험군', '해당', '경우', '유전상담', '구체', '검진', '관리', '방법', '설명', '중요', '일반', '유방암', '가족력', '경우', '검진', '권고', '위험요인', '최소', '생활', '방식', '개선', '유방암', '예방', '도움']"
150,"결론적으로, 특히 호르몬 수용체양성 유방암에서 정기적으로 술을 마시는 것이 유방암 위험을 높일 수 있음을 알 수 있습니다. 하지만 술은 유방암의 수 많은 위험요인 중에 하나입니다. 술이 유방암 위험을 높일 수 있다고 하더라도, 한가지 요인만으로 유방암이 발생하거나 예후가 나빠질 확률은 매우 낮아요. 따라서, 가끔 한번씩 술을 마시는 것은 괜찮지만 정기적으로 섭취하는 것은 지양하는것을 추천드려요.","['결론', '호르몬', '수용체양성', '유방암', '정기', '유방암', '위험', '유방암', '위험요인', '하나', '유방암', '위험', '가지', '요인', '유방암', '발생', '예후', '확률', '정기', '섭취', '지양', '추천']"
152,"유방암 4기와 유방암 말기의 차이점에 대해 설명드리도록 하겠습니다. 유방암 4기와 유방암 말기는 비슷하게 보이지만 실제로는 다른 질병의 상태를 의미합니다. 먼저, 유방암 4기는 유방암이 폐, 뼈, 간, 뇌 등 다른 장기로 전이가 되었으나 항암화학요법, 방사선치료 등을 활용하여 질병의 진행을 늦출 수 있는 상태를 말합니다. 하지만 유방암 말기는 항암화학요법이나 방사선치료 등으로 호전되지 않는 질병의 상태를 의미합니다.","['유방암', '유방암', '말기', '차이점', '설명', '유방암', '유방암', '말기', '질병', '상태', '의미', '유방암', '유방암', '장기', '전이', '항암화학요법', '방사선치료', '활용', '질병', '진행', '상태', '유방암', '말기', '항암화학요법', '방사선치료', '호전', '질병', '상태', '의미']"
159,"유방암은 여성에게서 가장 흔히 발견되지만 남성도 유방암에 걸릴 수 있습니다. 건강보험심사평가원의 자료에 따르면, 전체 유방암 환자의 숫자가 늘어나면서 남성 유방암 환자도 증가하고 있으며 2012년 48명이었던 남성유방암 환자의 수가 2019년에는 711명으로 유의미하게 늘어나는 추세임이 확인되었습니다.","['유방암', '여성', '발견', '남성', '유방암', '건강', '보험', '심사', '평가원', '자료', '전체', '유방암', '환자', '숫자', '남성', '유방암', '환자', '증가', '남성', '유방암', '환자', '유의미', '추세', '확인']"
164,유방암수술 후 구체적인 팔 운동 방법은 수술 후 운동 동영상을 참고해주세요. 각각의 운동은 양쪽 팔을 움직이며 하루에 5~7회씩 하는 것이 적당합니다. 하지만 운동을 하는 도중 통증을 느끼거나 힘이 든다면 즉시 운동을 중단하고 휴식을 취하시길 바랍니다.,"['유방암수술', '구체', '운동', '방법', '수술', '운동', '동영상', '참고', '각각', '운동', '양쪽', '하루', '운동', '도중', '통증', '즉시', '운동', '중단', '휴식']"
166,유방암 치료과정과 임신 준비 과정 모두 조심스럽고 중요한 결정이라 많은 고민이 있으실 것 같습니다. 그 고민에 도움이 될 수 있도록 답변드리겠습니다.,"['유방암', '치료과정', '임신', '준비', '과정', '조심', '중요', '결정', '고민', '고민', '도움', '답변']"
169,"한국유방암학회에서는 30세 이후 매월 유방 자가 검진을 권장하고 있으며, 35세 이후 2년 간격으로 의사의 진찰을 권유하고 있습니다. 유방촬영술 또는 유방초음파 검사는 이때 시행하게 되며, 그 외 유방암 증상이 있거나 위험군일 경우 더 일찍부터 검사를 권장하고 있습니다.","['한국', '유방암', '학회', '이후', '유방', '자가', '검진', '권장', '이후', '간격', '의사', '진찰', '권유', '유방촬영술', '유방초음파', '검사', '이때', '시행', '유방암', '증상', '위험군', '경우', '검사', '권장']"
178,"유방암 치료에 사용되는 항암제는 매우 다양해요. 유방암 치료에 탁월한 효과가 있어 오랜기간동안 사용되고 있는 약제도 있고, 유방암에 효과가 있는 약제로 새롭게 주목받아 임상시험을 거친 후 사용되는 약제도 있습니다. 하지만 모든 약제를 쓸 수 있는 것은 아니에요. 국내에서 유방암 치료를 받을 때 어떤 기준으로 항암제가 처방되는지 궁금한 경우가 많으실 것으로 생각되어 관련 내용을 다음과 같이 정리해 보았어요.","['유방암', '치료', '사용', '항암제', '다양', '유방암', '치료', '효과', '기간', '동안', '사용', '약제', '유방암', '효과', '약제', '주목', '임상', '시험', '사용', '약제', '약제', '국내', '유방암', '치료', '기준', '항암제', '처방', '경우', '생각', '관련', '내용', '다음', '정리']"
180,추가적으로 유방암 재발 위험 감소에 도움이 되는 생활 습관은 다음과 같습니다.,"['추가', '유방암', '재발', '위험', '감소', '도움', '생활', '습관', '다음']"
202,"이런 경우 외에도 방사선 노출이 걱정되신다면 말씀하신 유방초음파 검사를 고려해 볼 수 있습니다. 유방초음파 검사는 고주파수의 음파를 이용하는 검사로 인체에 해롭지 않아, 어린 나이에 검사를 해도 안전합니다. 따라서 35세 미만의 젊은 여성이 유방암 검진을 원하는 경우 유방초음파 검사를 시행하기도 합니다.","['경우', '방사선', '노출', '걱정', '말씀', '유방초음파', '검사', '고려', '유방초음파', '검사', '고주파', '음파', '이용', '검사', '인체', '나이', '검사', '안전', '미만', '여성', '유방암', '검진', '경우', '유방초음파', '검사', '시행']"
207,"일반적으로 유방암을 진단받은 후 수술과 항암화학요법을 포함한 다양한 치료방법들을 가능하면 빨리 받는 것이 좋다고 알려져 있습니다. 하지만, 온코타입 검사 결과 확인 날짜를 일주일 미루는 것이 치료 시작 시점을 일주일 늦추는 것과 같은 의미는 아닐 것으로 사료됩니다.  치료계획을 늦추는 것에 대해 체계적문헌고찰 결과, 일주일 단위로 연구를 한 논문은 찾지 못하였습니다. 하지만, 진료 및 치료를 조금씩 늦추는 것이 반복되면 치료 결과에 부정적인 영향을 미칠 수 있다는 연구를 확인할 수 있었기에 가급적이면 추후 진료 예약은 늦추지 않는 것을 권유 드립니다.","['일반', '유방암', '진단', '수술', '항암화학요법', '포함', '다양', '치료방법', '가능', '타입', '검사', '결과', '확인', '날짜', '일주일', '치료', '시작', '시점', '일주일', '의미', '사료', '치료계획', '체계적문헌고찰', '결과', '일주일', '단위', '연구', '논문', '진료', '치료', '조금', '반복', '치료', '결과', '부정', '영향', '연구', '확인', '가급적', '추후', '진료', '예약', '권유']"
210,"먼저, 뼈 스캔은 우리 몸 전신의 뼈 상태를 훑어보는 검사입니다. 뼈전이 발생률이 높은 유방암의 특성 상, 뼈에 전이가 의심되는 경우 뼈 스캔을 통한 확인이 필요합니다. 주로 유방암 치료가 모두 끝난 후에 약 5년간 진행되는 추적 관찰 검사 시에 6개월 ~ 1년 주기로 진행해요. 뼈 스캔으로 확인할 수 있는것은 뼈 전이 여부, 유방암 치료 경과 관찰, 골종양 여부, 뼈의 염증 여부 확인 등입니다. 참고로, 뼈 스캔을  할때 주의할 사항은 다음과 같아요.","['스캔', '우리', '전신', '상태', '검사', '전이', '발생', '유방암', '특성', '전이', '의심', '경우', '스캔', '확인', '필요', '유방암', '치료', '진행', '추적', '관찰', '검사', '개월', '주기', '진행', '스캔', '확인', '전이', '여부', '유방암', '치료', '경과', '관찰', '종양', '여부', '염증', '여부', '확인', '참고', '스캔', '주의', '사항', '다음']"
221,유방암은 여러 암 중에서도 음식의 제약으로부터 비교적 자유로운 암에 속하기 때문에 음식을 너무 엄격하게 관리하느라 스트레스를 받으시기보다는 영양소의 종류와 구성을 잘 고려하여 드시는 것이 중요합니다.,"['유방암', '음식', '제약', '비교', '자유', '때문', '음식', '관리', '스트레스', '영양소', '종류', '구성', '고려', '중요']"
256,"운동은 유방암의 치료과정에서 건강을 유지할 수 있는 가장 중요한 활동 중 하나이며, 치료 중에 운동하는 것은 삶의 질 향상, 부작용 감소에 긍정적인 영향을 미칩니다. 따라서, 유방암 치료 기간에도 꾸준히 운동하는 것이 매우 중요합니다. 수술 1~2일 후에는 전신마취 기운이 남아있을 수 있으므로 충분한 휴식 취하고, 수술 후 1주일 이내에 가벼운 활동 시작(걷기, 팔운동 등)하는 것을 추천드립니다.","['운동', '유방암', '치료과정', '건강', '유지', '중요', '활동', '하나', '치료', '운동', '향상', '부작용', '감소', '긍정', '영향', '유방암', '치료', '기간', '운동', '중요', '수술', '전신', '마취', '기운', '휴식', '수술', '주일', '이내', '활동', '시작', '걷기', '운동', '추천']"
262,"체중 증가와 비만은 유방암의 수 많은 위험요인중에 하나입니다. 체중증가가 유방암 위험을 높일 수 있다고 하더라도, 한가지 요인만으로 유방암이 발생하거나 예후가 나빠질 확률은 매우 낮아요. 따라서, 가벼운 운동이라도 꾸준히 시행하고 식단관리를 하셔서 적정 체중을 유지하려는 노력을 하시되, 체중관리에 대해서 너무 걱정하시기보다는 천천히 꾸준히 관리시는것을 추천드려요.","['체중', '증가', '비만', '유방암', '위험요인', '하나', '체중', '증가', '유방암', '위험', '가지', '요인', '유방암', '발생', '예후', '확률', '운동', '시행', '식단', '관리', '적정', '체중', '유지', '노력', '체중', '관리', '걱정', '관리', '추천']"
269,"-40세 이전에 유방암을 앓은 분
-가족 중에 유방암, 난소암, 전이성 전립선암, 췌장암을 겪은 사람이 있는 분
-다발성 유방암 환자
-남성 유방암 환자
-만 60세 이하에서 삼중음성 유방암이 발병한 환자
-양쪽 유방 모두 유방암이 발병한 환자
-BRCA 유전자 변이가 있다고 밝혀진 환자의 가족","['이전', '유방암', '가족', '유방암', '난소암', '전이', '전립선암', '췌장암', '사람', '발성', '유방암', '환자', '남성', '유방암', '환자', '이하', '삼중', '음성', '유방암', '발병', '환자', '유방', '유방암', '발병', '환자', '유전자', '변이', '환자', '가족']"
282,"2. 보조 항암화학요법(수술 후 항암)
유방암수술을 받은 후 혹시 남아있을지 모르는 미세한 암세포를 제거하고 재발 위험을 줄이기 위해 시행됩니다. 일반적으로 보조 항암화학요법이 시행되는 경우는 아래와 같습니다.","['보조', '항암화학요법', '수술', '항암', '유방암수술', '미세', '암세포', '제거', '재발', '위험', '시행', '일반', '보조', '항암화학요법', '시행', '경우', '아래']"
286,"유방암 재발은 흔히 발생하지는 않으며, 발생하더라도 대부분 효과적으로 치료할 수 있습니다. 또한, 치료가 끝난 후 5년간 시행되는 추적관찰을 통해 지속적으로 재발 여부를 확인하고 있기 때문에 너무 걱정하지 않으시길 바랍니다.","['유방암', '재발', '발생', '발생', '대부분', '효과', '치료', '치료', '시행', '추적', '관찰', '지속', '재발', '여부', '확인', '때문', '걱정']"
294,"전절제술 후 보형물 삽입, 유두재건술을 앞두고 계시군요. 먼저 유방암 진단과 전절제술로 인해 많이 혼란스럽고 걱정이 되실 것 같습니다. 저희의 답변이 도움이 되기를 바라며 질문 주신 사항에 대해서 설명드리겠습니다.","['절제술', '삽입', '유두', '재건', '유방암', '진단', '절제술', '혼란', '걱정', '저희', '답변', '도움', '질문', '주신', '사항', '설명']"
295,"운동은 유방암의 치료과정에서 건강을 유지할 수 있는 가장 중요한 활동 중 하나이며, 치료 중에 운동을 하는 것은 삶의 질 향상, 부작용 감소에 긍정적인 영향을 미칩니다. 따라서, 유방암 치료 기간에도 꾸준히 운동을 하는 것이 매우 중요합니다. 하지만 치료과정에 방해가 되거나 무리한 운동을 하는것은 적절하지 않아요. 따라서 유방암의 치료과정에서 다음과 같은 주의사항을 지키며  규칙적인 운동을 꾸준히 하시는것을 추천드립니다.","['운동', '유방암', '치료과정', '건강', '유지', '중요', '활동', '하나', '치료', '운동', '향상', '부작용', '감소', '긍정', '영향', '유방암', '치료', '기간', '운동', '중요', '치료과정', '방해', '무리', '운동', '유방암', '치료과정', '다음', '주의', '사항', '규칙', '운동', '추천']"
