Unnamed: 0,answer,words
757,"유방암의 성장 속도는 유방암의 종류, 병기, 환자분의 나이, 유전자 변이 등에 따라 달라질 수 있습니다. 또한, 국내 유방암 환자 1702명을 대상으로 시행된 일부 연구에 따르면 유방암 진단 후 수술하기 전까지 지연되는 시간에 따른 생존율의 차이를 연구하였을 때 대기 시간이 6개월 이하인 경우 생존율의 차이가 미미하다는 결과를 확인할 수 있었습니다. 질문내용만으로는 유방암의 종류와 질문자분의 전반적인 상태를 확인하기 어려워 자세한 답변을 드리지 못한 점 양해 부탁드립니다.","['유방암', '성장', '속도', '유방암', '종류', '병기', '환자', '나이', '유전자', '변이', '국내', '유방암', '환자', '대상', '시행', '일부', '연구', '유방암', '진단', '수술', '지연', '시간', '생존', '차이', '연구', '대기', '시간', '개월', '이하', '경우', '생존', '차이', '결과', '확인', '질문내용', '유방암', '종류', '질문자', '전반', '상태', '확인', '답변', '양해', '부탁']"
762,"또한, 2014년 유럽에서 유방 절제술 및 겨드랑이 림프절 절제 수술 후 방사선 요법을 받은 환자를 대상으로 10년 재발률 및 20년 유방암 사망률을 확인한 연구 결과에 따르면, 1~3개의 림프절에 유방암이 있는 1,000명 이상의 여성에서 유방전절제술 후 방사선치료를 시행했을 때, 재발 위험이 32% 감소하고 생존율은 20% 향상되었음이 확인되었습니다. 물론, 이 결과는 일부 유방암 환자를 대상으로 한 연구이기 때문에 절대적인 것은 아니지만 전절제술 후 방사선치료를 받았을 때 긍정적인 영향이 확인되었음을 알 수 있었습니다.","['유럽', '유방', '절제술', '겨드랑이', '림프절', '절제', '수술', '방사선', '요법', '환자', '대상', '유방암', '사망', '확인', '연구', '결과', '림프절', '유방암', '이상', '여성', '유방', '절제술', '방사선치료', '시행', '재발', '위험', '감소', '생존', '향상', '확인', '결과', '일부', '유방암', '환자', '대상', '연구', '때문', '절대', '절제술', '방사선치료', '긍정', '영향', '확인']"
765,"Ki-67 수치가 높으면 유방암세포가 더 빠르게 성장하며, 유방암세포가 더 공격적인 경향을 띄기 때문에 일반적으로 Ki-67 수치가 높은 유방암은 Ki-67 수치가 낮은 유방암보다 예후가 좋지 않다고 알려져 있습니다. 하지만 유방암의 예후는 하나의 지표만으로 단정 지을 수 없으며 유방암의 크기, 에스트로겐 수용체, 프로게스테론 수용체, 허투 수용체 등 다양한 요인을 종합적으로 고려하여 결정됩니다. 따라서, Ki-67 수치만으로 예후를 판단할 수 없으니, 전반적인 조직 결과에 대한 설명을 종합적으로 참고하여 들으시는 것이 도움이 됩니다.","['수치', '유방암', '세포', '성장', '유방암', '세포', '공격', '경향', '때문', '일반', '수치', '유방암', '수치', '유방암', '예후', '유방암', '예후', '하나', '지표', '단정', '유방암', '크기', '에스트로겐', '수용체', '프로게스테', '수용체', '허투', '수용체', '다양', '요인', '종합', '고려', '결정', '수치', '예후', '판단', '전반', '조직', '결과', '설명', '종합', '참고', '도움']"
772,"유방암은 여러 암 중에서도 음식의 제약으로부터 비교적 자유로운 암에 속하기 때문에 음식을 너무 엄격하게 관리하느라 스트레스를 받으시기보다는 영양소의 종류와 구성을 잘 고려하여 드시는 것이 중요합니다.
 
유방암은 과도한 열량 섭취로 인한 체중 증가를 조심하고 규칙적인 운동을 통해 체중을 유지하려는 노력이 매우 중요합니다. 하지만, 항암화학요법 기간 동안에는 다양한 영양 성분이 포함된 음식을 충분히 섭취하시는 것이 치료과정에 도움이 될 수 있습니다.  유방암 환자에게 권고 되는 바람직한 식생활 습관은 다음과 같습니다.","['유방암', '음식', '제약', '비교', '자유', '때문', '음식', '관리', '스트레스', '영양소', '종류', '구성', '고려', '중요', '유방암', '과도', '열량', '섭취', '체중', '증가', '조심', '규칙', '운동', '체중', '유지', '노력', '중요', '항암화학요법', '기간', '동안', '다양', '영양', '성분', '포함', '음식', '섭취', '치료과정', '도움', '유방암', '환자', '권고', '식생활', '습관', '다음']"
784,"유방암은 여성 호르몬의 영향을 많이 받는 암입니다. 호르몬 수용체양성 유방암은 여성호르몬에 민감하게 반응하며 여성호르몬에 노출되는 상황에서 빠르게 자라납니다. 따라서, 호르몬 수용체양성 유방암 환자는 일반적으로 항호르몬요법을 받게 됩니다.","['유방암', '여성', '호르몬', '영향', '호르몬', '수용체양성', '유방암', '여성', '호르몬', '반응', '여성', '호르몬', '노출', '상황', '호르몬', '수용체양성', '유방암', '환자', '일반', '호르몬', '요법']"
789,"1. 현재 표적치료제인 키스칼리와 항호르몬제인 페마라를 복용 중이시군요. 해당 항암화학요법은 호르몬 수용체양성, HER2 음성인 진행성 또는 전이성 유방암 환자분들께 주로 행해지는 치료법인데요. 현재 질문자님께서 복용하시는 것처럼, 표적치료제와 항호르몬제 약물의 병용투여는 호르몬 수용체양성 전이성 유방암 환자에게 대부분 좋은 효과를 보입니다. 그러나 키스칼리에 더 이상의 효과를 기대할 수 없는 상황일 경우, 키스칼리와 비슷한 역할을 할 수 있는 표적치료제로 대체할 수 있습니다. 키스칼리와 같은 역할을 하는 표적치료제로는 버제니오(성분명:abemaciclib), 입랩스(성분명:palbociclib)가 있습니다. 키스칼리, 입랩스, 버제니오 약물에 대한 연구 결과에서 모두 호르몬 수용체양성/HER2 음성인 진행성 또는 유방암 환자에게 상당한 치료효과가 있었음을 보고하고 있습니다. 하지만 약물의 적합성과 약물의 효과 및 부작용은 개인에 따라 차이가 있어, 담당 의사 선생님이 환자분의 상태와 각종 검사 결과를 고려하여 결정해주실 것입니다.","['표적', '치료제', '키스칼리와', '호르몬제', '페마라', '복용', '해당', '항암화학요법', '호르몬', '수용체양성', '진행', '이성', '유방암', '환자', '치료법', '질문자', '복용', '표적', '치료제', '호르몬제', '약물', '병용', '투여', '호르몬', '수용체양성', '이성', '유방암', '환자', '효과', '키스', '칼리', '이상', '효과', '기대', '상황', '경우', '키스', '칼리', '역할', '표적', '치료제', '대체', '키스', '칼리', '역할', '표적', '치료제', '버제니오', '성분', '입랩스', '성분', '키스', '칼리', '입랩스', '버제니오', '약물', '연구', '결과', '호르몬', '수용체양성', '진행', '유방암', '환자', '상당', '치료', '효과', '보고', '약물', '적합', '약물', '효과', '부작용', '개인', '차이', '담당', '의사', '선생', '환자', '상태', '각종', '검사', '결과', '고려', '결정']"
797,"안녕하세요. 유방촬영술(맘모그램)이란, 유방암 검진의 기본이 되는 검사로 유방 조직을 기계로 눌러 찍는 엑스레이입니다. 유방암 국가건강검진 나이인 만 40세가 지나셨으므로 2년마다 유방촬영술 검사를 시행하는 것을 권장 드리며 검사는 국가지원 암 검진을 하는 병원, 대학병원의 유방암센터, 유방외과 의원 등에서 하실 수 있습니다.","['안녕하세요', '유방촬영술', '맘모', '그램', '유방암', '검진', '기본', '검사', '유방', '조직', '기계', '엑스레이', '유방암', '국가', '건강', '검진', '나이', '유방촬영술', '검사', '시행', '권장', '검사', '국가', '지원', '검진', '병원', '대학', '병원', '유방암', '센터', '유방', '외과', '의원']"
799,유방암 발생률을 높이는 것으로 알려진 위험요인들은 다음과 같습니다.,"['유방암', '발생', '위험요인', '다음']"
803,"유방암의 초기 증상에 대해서 궁금하시군요, 이에 대해서 답변드리겠습니다.","['유방암', '초기', '증상', '답변']"
814,"유방암은 암의 크기, 겨드랑이 림프절 전이 개수, 다른 장기로의 암 전이 여부에 따라 병기를 파악하게 되며 이때 전 세계적으로 사용하는 방식인 TNM 분류 방식을 이용하여 병기를 나누게 됩니다. TNM 분류 방식에 따르면 종양의 크기가 1.12cm일 경우 T1(종양의 크기가 2cm 이하)에 해당하며, 이후 림프절 전이, 다른 장기 등의 전이를 확인을 위한 검사가 필요합니다.","['유방암', '크기', '겨드랑이', '림프절', '전이', '개수', '장기로', '전이', '여부', '병기', '파악', '세계', '사용', '방식', '분류', '방식', '이용', '병기', '분류', '방식', '종양', '크기', '경우', '종양', '크기', '이하', '해당', '이후', '림프절', '장기', '전이', '확인', '검사', '필요']"
816,"삼중음성 유방암은 다른 침습적 유방암과 비교하여 더 빨리 성장하고 퍼지는 경향이 있고 항호르몬 요법이나 표적 치료에 효과가 없기 때문에 할 수 있는 치료의 종류가 더 적어 일반적으로 예후가 더 나쁘다고 알려져 있습니다. 이러한 점 때문에 삼중음성 유방암을 진단받게되면 걱정과 고민을 하시는 분들이 많아요. 하지만, 삼중음성 유방암을 진단 받았다 하더라도 다른 고형암(폐암, 위암, 대장암 등)과 비교하여 예후가 좋은 편에 속하며, 빨리 성장하고 퍼지는만큼 선행항암화학요법을 했을 때 다른 유방암 유형과 비교하여 가장 효과가 좋은 것으로 알려져 있어요. 실제로, 삼중음성 유방암에서 항암화학요법 후 암이 완전히 사라질 확률은 높게는 40~50%에 달합니다. 또한, 항호르몬 요법 및 표적 치료를 하지 않을 가능성이 높기 때문에 그에 따른 부작용을 경험하지 않을 확률이 높고, 치료과정이 비교적 간단하다는 장점이 있어요.","['삼중', '음성', '유방암', '침습', '유방암', '비교', '성장', '경향', '호르몬', '요법', '표적', '치료', '효과', '때문', '치료', '종류', '일반', '예후', '때문', '삼중', '음성', '유방암', '진단', '걱정', '고민', '삼중', '음성', '유방암', '진단', '고형', '폐암', '위암', '대장암', '비교', '예후', '성장', '만큼', '선행', '항암화학요법', '유방암', '유형', '비교', '효과', '삼중', '음성', '유방암', '항암화학요법', '확률', '호르몬', '요법', '표적', '치료', '가능', '때문', '부작용', '경험', '확률', '치료과정', '비교', '장점']"
817,"허투 수용체양성 유방암으로 나왔을 경우, 허투 수용체 음성 유방암보다 재발의 가능성이 높은 것으로 알려져 있습니다. 체계적문헌고찰 결과, 1cm 이하의 유방암을 진단 받은 여성 중 5년 이내의 재발률을 조사하였을 때 허투 수용체양성 유방암을 진단받은 여성의 10~23%, 허투 수용체 음성 유방암을 진단받은 여성의 5%가 재발한 것으로 나타났습니다. 하지만 최근 연구 결과에 따르면 허투 양성 유방암이라도 초기에 치료를 받을 경우, 치료결과가 효과적이었으며 예후가 좋은 것으로 나타났습니다.","['허투', '수용체양성', '유방암', '경우', '허투', '수용체', '음성', '유방암', '재발', '가능', '체계적문헌고찰', '결과', '이하', '유방암', '진단', '여성', '이내', '재발', '조사', '허투', '수용체양성', '유방암', '진단', '여성', '허투', '수용체', '음성', '유방암', '진단', '여성', '재발', '연구', '결과', '허투', '양성', '유방암', '초기', '치료', '경우', '치료', '결과', '효과', '예후']"
821,"2. 삼중음성유방암이란 에스트로겐, 프로게스테론, HER2 수용체가 모두 음성인 유방암을 의미합니다. 삼중음성 유방암은 전체 유방암의 10-20%를 차지하며, 다른 유방암에 비해 빠른 성장 속도를 특징으로 가지고 있습니다. 하지만, 빨리 성장하고 퍼지는 만큼 선행 항암화학요법을 했을 때 다른 유방암 유형과 비교하여 가장 효과가 좋은 경우도 있는 것으로 알려져 있습니다. 또한, 항호르몬요법과 표적치료를 하지 않을 가능성이 높기 때문에 다른 유방암보다 치료과정이 단순하고 부작용이 적다는 장점이 있습니다.","['삼중', '음성', '유방암', '에스트로겐', '프로게스테론', '수용체', '음성', '유방암', '의미', '삼중', '음성', '유방암', '전체', '유방암', '차지', '유방암', '성장', '속도', '특징', '성장', '만큼', '선행', '항암화학요법', '유방암', '유형', '비교', '효과', '경우', '호르몬', '요법', '표적', '치료', '가능', '때문', '유방암', '치료과정', '단순', '부작용', '장점']"
823,"-침습적 유방암인 경우
-BRCA 1,2 돌연변이가 있는 경우
-호르몬 수용체 음성으로 항호르몬 요법을 받을 수 없는 경우
-액와림프절이 전이 여부 음성, 양성 모두에서 시행 가능","['침습', '유방암', '경우', '돌연변이', '경우', '호르몬', '수용체', '음성', '호르몬', '요법', '경우', '-액와', '림프절', '전이', '여부', '음성', '양성', '모두', '시행', '가능']"
824,"따라서, 치료 전에 미리 걱정하시기보다는 유방암 진단 받은 후 뇌영양제 복용을 중단한 점과 기억력이 나빠지고 있다고 느끼는 부분을 항암화학요법 전에 담당의사선생님께 알리는 것을 권유 드립니다.","['치료', '걱정', '유방암', '진단', '영양제', '복용', '중단', '기억력', '부분', '항암화학요법', '담당의사선생님', '권유']"
831,"유방암수술과 방사선치료는 피부 변화 및 통증 등의 부작용을 야기할 수 있는 치료방법입니다. 일반적으로 시간이 지나면서 수술 부위 통증은 점차 줄어들게 되며, 방사선치료 또한 치료가 종료된 후 2-6주간에 걸쳐 부작용이 점차 사라지게 됩니다. 하지만, 치료가 끝난 이후에도 치료 부위 부종 및 통증, 유방의 섬유화와 같은 증상이 나타날 수 있습니다. 또한, 치료로 인해 피부가 약해진 상태로 직접적인 부작용이 아닌 외부 자극으로 인해 열감이나 통증과 같은 염증 증상을 경험할 가능성도 있습니다. 손으로 긁을 경우 말씀하신 것과 같이 상처가 생길 수 있으며 상처를 통해 감염과 같은 부작용이 생길 수 있기 때문에 손으로 최대한 만지지 않고 병원에 방문하셔서 적절한 치료를 받으시는 것이 좋습니다.","['유방암수술', '방사선치료', '피부', '변화', '통증', '부작용', '야기', '치료방법', '일반', '시간', '수술', '부위', '통증', '방사선치료', '치료', '종료', '주간', '부작용', '치료', '이후', '치료', '부위', '부종', '통증', '유방', '섬유화', '증상', '치료', '피부', '상태', '직접', '부작용', '외부', '자극', '통증', '염증', '증상', '경험', '가능', '경우', '말씀', '상처', '상처', '감염', '부작용', '때문', '병원', '방문', '치료']"
833,"해외 공신력 있는 기관에 따르면 간으로 주로 전이되는 암 유형에는 유방암, 식도암, 위암, 췌장암, 폐암, 신장암 및 흑색종 피부암 등과 함께 대장암도 속해있음을 확인할 수 있었습니다. 암의 간 전이로 나타날 수 있는 증상은 전이된 암세포의 위치나 크기 등에 따라 개인마다 다르게 나타날 수 있습니다. 간 전이로 나타나는 일반적인 증상은 오른쪽 복부 상부 통증, 황달, 복수, 식욕 저하, 피부 가려움 등이 있으며, 나타나는 증상에 따라 추가 치료를 시행합니다. 이러한 간 전이 치료방법에는 항암화학요법, 방사선치료, 수술, 색전술이 있습니다.","['해외', '공신력', '기관', '전이', '유형', '유방암', '식도암', '위암', '췌장암', '폐암', '신장', '흑색종', '피부암', '대장암', '확인', '전이', '증상', '전이', '암세포', '위치', '크기', '개인', '전이', '일반', '증상', '오른쪽', '복부', '상부', '통증', '황달', '복수', '식욕', '저하', '피부', '가려움', '증상', '추가', '치료', '시행', '치료방법', '항암화학요법', '방사선치료', '수술', '색전술']"
838,"하지만 유방암의 예후는 하나의 지표만으로 단정 지을 수 없으며 유방암의 크기, 에스트로겐 수용체, 프로게스테론 수용체, 허투 수용체 등 다양한 요인을 종합적으로 고려하여 결정됩니다. 삼중음성 유방암은 다른 침습적 유방암과 비교하여 Ki-67 수치가 높은 경우가 많아 더 빨리 성장하고 퍼지는 경향이 있고 항호르몬요법이나 표적치료에 효과가 없기 때문에 할 수 있는 치료의 종류가 더 적어 일반적으로 예후가 더 나쁜 경향이 있습니다. 하지만, 삼중음성 유방암이라 하더라도 다른 고형암(폐암, 위암, 대장암 등)과 비교하여 예후가 좋은 편에 속하며, 빨리 성장하고 퍼지는 만큼 선행 항암화학요법을 했을 때 다른 유방암 유형과 비교하여 가장 효과가 좋은 경우도 있는 것으로 알려져 있어요. 또한, 항호르몬 요법 및 표적치료를 하지 않을 가능성이 높기 때문에 그에 따른 부작용을 경험하지 않을 확률이 높고, 치료과정이 비교적 간단하다는 장점이 있습니다. 따라서, 질문자님의 현재 상태와 질병 상태를 가장 잘 알고 계시는 담당의사선생님을 믿고 치료과정 또는 검진 일정에 잘 참여하시는 것이 예후에 가장 중요합니다.","['유방암', '예후', '하나', '지표', '단정', '유방암', '크기', '에스트로겐', '수용체', '프로게스테', '수용체', '허투', '수용체', '다양', '요인', '종합', '고려', '결정', '삼중', '음성', '유방암', '침습', '유방암', '비교', '수치', '경우', '성장', '경향', '호르몬', '요법', '표적', '치료', '효과', '때문', '치료', '종류', '일반', '예후', '경향', '삼중', '음성', '유방암', '고형', '폐암', '위암', '대장암', '비교', '예후', '성장', '만큼', '선행', '항암화학요법', '유방암', '유형', '비교', '효과', '경우', '호르몬', '요법', '표적', '치료', '가능', '때문', '부작용', '경험', '확률', '치료과정', '비교', '장점', '질문자', '현재', '상태', '질병', '상태', '담당의사선생님', '치료과정', '검진', '일정', '참여', '중요']"
839,"타목시펜과 루프린 주사는 항호르몬요법으로 일반적으로 호르몬 수용체양성인 유방암 환자에게 사용되는 보조적인 치료방법입니다. 타목시펜을 복용하는 경우 일반적으로 폐경 증상이라고 알려진 안면홍조, 피로감, 식욕저하, 감정 변화, 관절염 등의 증상을 경험할 수 있습니다. 또한, 폐경 전 초기 호르몬 수용체양성 유방암 환자에게 재발 예방의 목적으로 투약할 수 있는 루프린 주사 같은 경우에도 타목시펜 부작용과 비슷한 부작용을 야기할 수 있습니다. 약학정보원에 따르면 이 두 약물은 앞서 말한 부작용 외에 여러 부위 통증을 유발할 수 있으며, 생리주기 변화와 함께 피로감을 야기할 수 있음을 확인할 수 있었습니다.","['타목시펜', '루프린', '주사', '호르몬', '요법', '일반', '호르몬', '수용체양성', '유방암', '환자', '사용', '보조', '치료방법', '타목시펜', '복용', '경우', '일반', '폐경', '증상', '안면', '홍조', '피로감', '식욕', '저하', '감정', '변화', '관절염', '증상', '경험', '폐경', '초기', '호르몬', '수용체양성', '유방암', '환자', '재발', '예방', '목적', '투약', '루프린', '주사', '경우', '타목시펜', '부작용', '부작용', '야기', '약학정보원', '약물', '부작용', '부위', '통증', '유발', '생리', '주기', '변화', '피로감', '야기', '확인']"
840,"또한, 이차 암에 대해서 설명드리겠습니다. 조기 폐암 환자의 약 7%에서 이차 암이 보고되며, 흡연력에 따라 이차 암의 발생률이 달라집니다. 구체적으로는 비흡연자의 경우 이차 암 발생 확률이 0%, 과거 흡연자의 경우 4%, 현재 흡연자의 경우에는 15%로 현재 흡연을 하고 있는 경우에 이차 암 발생 위험성이 가장 높습니다. 따라서, 흡연자인 경우에는 금연을 강력히 권고됩니다. 이차 암의 검진은 가족력, 암 치료, 그리고 비만/흡연 등의 환경적 요인을 고려하여 대장암, 전립선암, 유방암, 자궁경부암 검진이 1~3년 이내로 권유됩니다.","['이차', '설명', '조기', '환자', '이차', '보고', '흡연', '이차', '발생', '구체', '흡연자', '경우', '발생', '확률', '과거', '흡연자', '경우', '흡연자', '경우', '현재', '흡연', '경우', '발생', '위험', '흡연자', '경우', '금연', '권고', '검진', '가족력', '치료', '비만', '흡연', '환경', '요인', '고려', '대장암', '전립선', '유방암', '자궁', '경부', '검진', '이내', '권유']"
843,"보조 항암화학요법이란 수술 후에 혹시 남아있을 수 있는 암을 깨끗하게 제거하기 위한 목적으로 시행되는 항암화학요법의 방법입니다. 유방암수술로 눈에 보이는 유방암을 모두 제거하지만, 침습적인 유방암의 특성 상 어떤 경우에는 수술 후에도 눈에 보이지 않는 미세한 암세포가 남아있을 수 있습니다. 또한 암세포는 혈류나 림프계를 타고 이동할 수 있으며 혈류나 림프계를 타고 이동한 암은 새로운 종양을 형성할 수 있습니다. 따라서 이를 예방하기 위해 보조적 항암화학요법을 받게돼요.","['보조', '항암화학요법', '수술', '제거', '목적', '시행', '항암화학요법', '방법', '유방암수술', '유방암', '제거', '침습', '유방암', '특성', '경우', '수술', '미세', '암세포', '암세포', '혈류', '림프', '이동', '혈류', '림프', '이동', '종양', '형성', '예방', '보조', '항암화학요법']"
865,"또한, 음식관리와 관련하여 답변드리겠습니다. 유방암 치료 중 항호르몬제를 복용하는 경우 뼈 손실이 주요 부작용으로 주로 나타날 수 있습니다. 칼슘은 또한 유방암 치료과정으로 인해 발생할 수 있는 뼈 약화를 예방하는 데 도움이 될 수 있습니다. 또한 여러 연구에서는 칼슘이 유방암 및 결장직장암과 같은 특정 암의 위험을 줄이는 데 도움이 될 수 있다는 결과가 확인되었습니다. 따라서 주치의 선생님과의 상의 후에 환자분의 상황에서 칼슘 섭취가 필요한지, 그리고 어느정도 용량이 도움이 되는지에 대해 충분히 상의하신 후에 칼슘섭취를 해보시는 것이 도움이 될 수 있습니다. 참고로, 칼슘이 많이 함유된 음식은 아래와 같습니다.","['음식', '관리', '관련', '답변', '유방암', '치료', '호르몬제', '복용', '경우', '손실', '주요', '부작용', '칼슘', '유방암', '치료과정', '발생', '약화', '예방', '도움', '연구', '칼슘', '유방암', '결장', '직장암', '특정', '위험', '도움', '결과', '확인', '주치의', '선생', '상의', '환자', '상황', '칼슘', '섭취', '필요', '정도', '용량', '도움', '상의', '칼슘', '섭취', '도움', '참고', '칼슘', '함유', '음식', '아래']"
870,"3. 심리적 건강
유방암이 의심되는 순간부터 치료 후 회복될 때까지의 긴 시간 동안 불안, 우울, 스트레스 등과 같은 부정적인 감정들을 경험할 수 있습니다. 충분한 휴식, 자신만의 스트레스 해소 방법 활용하기, 규칙적인 운동, 전문가와의 상담 등을 통해 부정적인 감정을 외면하지 마시고 완화시키는 것을 추천드립니다.","['심리', '건강', '유방암', '의심', '순간', '치료', '회복', '시간', '동안', '불안', '우울', '스트레스', '부정', '감정', '경험', '휴식', '자신', '스트레스', '해소', '방법', '활용', '규칙', '운동', '전문가', '상담', '부정', '감정', '외면', '완화', '추천']"
