Unnamed: 0,answer,words
1966,"약물에 대한 부작용으로 두근거림이 느껴졌을 수도 있지만, 항암에 대한 불안감 또는 걱정으로 인해 나타나는 증상일 수 있으니 너무 걱정하시기보다는 이후 외래 진료 또는 추후 항암제를 투여할 때 비슷한 증상이 있을 경우 바로 의료진에게 알려 도움을 받으실 수 있는지 확인해 보시는 것을 권유 드립니다. 별도로 질문하신 AC항암과 관련하여 심장보호제에 대한 자세한 내용은 다음과 같습니다.
AC 항암이란 독소루비신(Doxorubicin)과 사이클로포스파미드(Cyclophosphamide)를 투여하는 항암화학요법입니다. 이때 사용되는 독소루비신의 대표적인 부작용 중 하나는 심장독성으로 심장 기능에 영향을 주어 부정맥이나 심부전 등을 유발할 수 있으며  예방하기 위해 말씀하신 심장 보호제를 맞는 경우도 흔한 편입니다. 심장보호제인 덱스라족산 (Dexrazoxane)은 카디옥산으로 불리기도 하며 항암제 누적 용량이 일정 수준을 초과한 전이성 유방암, 고령이거나 심장 질환이 있는 경우가 아니면 보험 적용이 되지 않기 때문에 개인 보험으로 지원이 가능한지 사전에 알아보시는 것을 추천드립니다.","['약물', '부작용', '항암', '불안감', '걱정', '증상', '걱정', '이후', '외래', '진료', '추후', '항암제', '투여', '증상', '경우', '의료진', '도움', '확인', '권유', '별도', '질문', '항암', '관련', '심장', '보호', '내용', '다음', '항암', '독소루비신', '사이클로포스파미드', '투여', '항암화학요법', '사용', '독소', '루비', '대표', '부작용', '하나', '심장', '독성', '심장', '기능', '영향', '부정맥', '심부전', '유발', '예방', '말씀', '심장', '보호', '경우', '심장', '보호', '덱스라족산', '카디', '옥산', '항암제', '누적', '용량', '일정', '수준', '초과', '이성', '유방암', '고령', '심장', '질환', '경우', '보험', '적용', '때문', '개인', '보험', '지원', '가능', '사전', '추천']"
1967,"항암화학요법 중 음식과 관련된 내용이 궁금하시군요. 유방암은 암중에서 음식의 제약으로부터 비교적 자유로운 암에 속하지만, 치료기간에는 치료방법에 따라 주의해야할 사항들이 있습니다. 특히, 항암화학요법을 받는 시기에는 항암제의 부작용으로 인해 음식 섭취에 어려움을 겪는 경우도 많고 조심해야할 음식도 있어요. 따라서, 유방암 치료의 과정에서 음식과 관련하여 특히 조심해야할 일반적인 사항을 정리해 보았고, 그 내용은 다음과 같습니다.","['항암화학요법', '음식', '관련', '내용', '유방암', '음식', '제약', '비교', '자유', '치료', '기간', '치료방법', '주의', '사항', '항암화학요법', '시기', '항암제', '부작용', '음식', '섭취', '어려움', '경우', '조심', '음식', '유방암', '치료', '과정', '음식', '관련', '조심', '일반', '사항', '정리', '내용', '다음']"
1969,"마지막으로 질병관리청 감염병포털에서 발표한 자료에 따르면, 녹농균은 널리 자연환경에 분포하고 있는 균으로 건강인의 약 5%에서 장관 내에 존재하고 입원 환자의 경우 30% 정도에서 존재하는 균으로 면역력이 저하된 상태나 암 치료과정에서 침습적인 시술이나 수술을 할 때 감염될 수 있습니다. 유방암수술 후 침습적 처치 또는 외부로 노출되어있는 배액관과 관련하여 녹농균 등의 다양한 원인균으로 인한 감염이 생길 수 있습니다. 항생제 투여 기간과 항암화학요법 시작 시점은 감염이 모두 치료된 후 주치의 선생님의 판단 하에 결정될 것으로 생각되어 주치의 선생님과의 상담이 필요할 것으로 생각됩니다.","['마지막', '질병', '관리청', '감염병', '포털', '발표', '자료', '자연환경', '분포', '건강', '장관', '존재', '입원', '환자', '경우', '정도', '존재', '면역력', '저하', '상태', '치료과정', '침습', '시술', '수술', '감염', '유방암수술', '침습', '처치', '외부', '노출', '배액관', '관련', '녹농균', '다양', '원인', '감염', '항생제', '투여', '기간', '항암화학요법', '시작', '시점', '감염', '치료', '주치의', '선생', '판단', '결정', '생각', '주치의', '선생', '상담', '필요', '생각']"
1971,"유방암은 암 중에서 음식의 제약으로부터 비교적 자유로운 암에 속합니다. 하지만, 과도한 열량 및 지방 섭취로 인한 체중 증가를 조심해야 하며 규칙적인 운동과 적절한 식사를 통해서 체중을 유지하는 것이 중요합니다. 따라서, 치료 기간 동안에는 암과 싸울 수 있는 체력을 위해 영양분을 고르게 잘 드시는 것이 중요하며, 국가암정보센터에서는 암 환자 포함 성인의 바람직한 에너지원 구성으로 1일 기준 지방 20 ~ 35%, 탄수화물 45 ~ 65%, 단백질 10 ~ 35%을 권고하고 있습니다. 또, 적극적인 치료 후에는 적정 체중을 유지할 수 있도록 건강한 식습관과 더불어 운동을 주기적으로 하시는 것을 추천드립니다. 도움이 되는 운동은 크게 전신 운동과 팔 운동이 있으며, 전신운동은 신체적 & 정신적 건강을 유지하여 삶의 질을 향상시키고 생존율을 높이는데 효과가 있습니다. 팔운동은 팔의 가동범위을 넓히고, 림프부종 예방에 도움을 줄 수 있습니다.","['유방암', '음식', '제약', '비교', '자유', '과도', '열량', '지방', '섭취', '체중', '증가', '조심', '규칙', '운동', '식사', '체중', '유지', '중요', '치료', '기간', '동안', '체력', '영양분', '중요', '국가암정보센터', '환자', '포함', '성인', '에너지', '구성', '기준', '지방', '탄수화물', '단백질', '권고', '적극', '치료', '적정', '체중', '유지', '건강', '식습관', '운동', '주기', '추천', '도움', '운동', '전신', '운동', '운동', '전신', '운동', '신체', '정신', '건강', '유지', '향상', '생존', '효과', '운동', '가동', '범위', '림프부종', '예방', '도움']"
1974,"질문에 대한 답변부터 드리자면 호르몬 양성 유방암일 경우 표적 항암제 사용 여부는 알 수 없으며,  추가 고려 사항들을 확인 후 표적 항암제 사용 여부를 결정하게 됩니다. 자세한 내용은 다음과 같습니다.","['질문', '답변', '호르몬', '양성', '유방암', '경우', '표적', '항암제', '사용', '여부', '추가', '고려', '사항', '확인', '표적', '항암제', '사용', '여부', '결정', '내용', '다음']"
1984,"유방초음파는 2021년 4월부터 건강보험정책심의위원회의 결정에 따라 건강보험이 확대되었고, 구체적으로 건강보험이 적용되는 경우는 다음과 같습니다.
-유방 내 악성종양 및 유방질환이 의심되는 경우, 진단시 1회 급여
-유방암 또는 유방질환 경과관찰 시 1회 급여
-시술/수술 후 진단 시 영상과 비교 목적으로 시행하는 경우","['유방초음파', '건강', '보험', '정책', '심의', '위원회', '결정', '건강', '보험', '확대', '구체', '건강', '보험', '적용', '경우', '다음', '유방', '악성', '종양', '유방', '질환', '의심', '경우', '진단', '급여', '유방암', '유방', '질환', '경과', '관찰', '급여', '시술', '수술', '진단', '영상', '비교', '목적', '시행', '경우']"
1986,"문헌고찰 결과 커피를 마시는 행위와 암 발병 간의 관계성이 현재까지 불분명함을 확인할 수 있었습니다. 일부 연구에 따르면, 커피 섭취가 유방암과 대장암을 포함한 몇몇 암종의 위험 감소, 신체 에너지 소비 증가, 암 전이 억제 등 다양한 이점이 있음을 확인할 수 있었으나 이는 추가적인 연구가 필요합니다.","['문헌', '고찰', '결과', '커피', '행위', '발병', '관계', '현재', '확인', '일부', '연구', '커피', '섭취', '유방암', '대장암', '포함', '암종', '위험', '감소', '신체', '에너지', '소비', '증가', '전이', '억제', '다양', '이점', '확인', '추가', '연구', '필요']"
2023,"술이 유방암 위험성을 증가시키는 이유는 호르몬 수용체양성 유방암과 관련된 에스트로겐 및 기타 호르몬 수치를 증가시킬 수 있으며, 세포의 DNA를 손상시킬 수 있기 때문입니다.","['유방암', '위험', '증가', '이유', '호르몬', '수용체양성', '유방암', '관련', '에스트로겐', '기타', '호르몬', '수치', '증가', '세포', '손상', '때문']"
2024,"또한, 앞서 말씀드린 것 처럼 항암화학요법의 효과가 미미하여 유방암이 뼈로 전이 된 경우 뼈의 통증이 나타날 수도 있습니다. 이 경우에는 항암제의 종류 혹은 치료방법을 변경하는 등의 의학적 조치가 취해질 수 있습니다.","['말씀', '항암화학요법', '효과', '유방암', '전이', '경우', '통증', '경우', '항암제', '종류', '치료방법', '변경', '의학', '조치']"
2026,"먼저 유전인자란, 가족력이 있는 경우를 말하며 가까운 친척을 포함한 가족 구성원 중 특정 질환을 가지고 있는 사람이 있을 경우 그 질환이 생길 확률이 높은 것을 의미합니다. BRCA는 대표적인 유방암의 유전인자 중 하나이며, 특히 가족 내에서 유전될 확률이 높고 자녀에게 유전될 가능성은 아들과 딸 동일하게 50%입니다. 한국인 유전성유방암연구에 따르면, 가족 내 유방암 환자 수가 늘어날수록 변이 유전자를 가지고 있을 확률이 크게 증가한다고 합니다. 가까운 가족 내에 유방암 환자가 여러 명인 경우, 변이 유전자가 있는지 의심해볼 수 있어요. BRCA 유전자 검사는 BRCA 유전자를 가지고 있을 확률이 높은 경우에 권유되며, 구체적으로 권유되는 상황은 다음과 같습니다.","['유전', '인자', '가족력', '경우', '친척', '포함', '가족', '구성원', '특정', '질환', '사람', '경우', '질환', '확률', '의미', '대표', '유방암', '유전', '인자', '하나', '가족', '유전', '확률', '자녀', '유전', '가능', '아들', '동일', '한국인', '유전', '유방암', '연구', '가족', '유방암', '환자', '변이', '유전자', '확률', '증가', '가족', '유방암', '환자', '경우', '유전자', '의심', '유전자', '검사', '유전자', '확률', '경우', '권유', '구체', '권유', '상황', '다음']"
2034,"유방암은 여러 암 중에서도 음식의 제약으로부터 비교적 자유로운 암에 속하기 때문에 음식을 너무 엄격하게 관리하느라 스트레스를 받으시기보다는 영양소의 종류와 구성을 잘 고려하여 드시는 것이 중요합니다. 유방암은 과도한 열량 섭취로 인한 체중 증가를 조심하고 규칙적인 운동을 통해 체중을 유지하려는 노력이 매우 중요합니다. 하지만, 항암화학요법 기간 동안에는 다양한 영양 성분이 포함된 음식을 충분히 섭취하시는 것이 치료과정에 도움이 될 수 있습니다. 유방암 환자에게 권고 되는 바람직한 식생활 습관은 다음과 같습니다.","['유방암', '음식', '제약', '비교', '자유', '때문', '음식', '관리', '스트레스', '영양소', '종류', '구성', '고려', '중요', '유방암', '과도', '열량', '섭취', '체중', '증가', '조심', '규칙', '운동', '체중', '유지', '노력', '중요', '항암화학요법', '기간', '동안', '다양', '영양', '성분', '포함', '음식', '섭취', '치료과정', '도움', '유방암', '환자', '권고', '식생활', '습관', '다음']"
2035,"결론부터 말씀드리자면, 유방암의 보조 치료로서 내분비요법(항호르몬요법)과 병용하는 버제니오(성분명: abemaciclib) 치료제는 재발 위험을 감소시킨다는 임상연구 결과를 보여주고 있습니다.","['결론', '말씀', '유방암', '보조', '치료', '내분비', '요법', '호르몬', '요법', '병용', '버제니오', '성분', '치료제', '재발', '위험', '감소', '임상', '연구', '결과']"
2050,"유방암 치료과정 동안 사용되는 약제로 인해 간 기능에 영향을 받을 수 있습니다. 체계적문헌고찰에 따르면, 타목시펜 또는 항암제와 같은 약제는 간 기능에 영향을 줄 수 있으며 간 수치가 상승할 수 있음을 확인할 수 있었습니다.","['유방암', '치료과정', '동안', '사용', '약제', '기능', '영향', '체계적문헌고찰', '타목시펜', '항암제', '약제', '기능', '영향', '수치', '상승', '확인']"
2051,"유방암의 전이 증상은 전이된 위치에 따라 매우 다양하게 나타날 수 있으며 림프절 전이, 다른 장기 등의 전이를 확인하기 위해서는 추가적인 정밀 검사가 필요합니다. 유방암의 병기와 전이 여부는 조직 병리학적 검사, 영상의학적 검사 등 추가적인 검사 결과들을 통합하여 결정합니다. 일반적으로 유방암수술 전 전반적인 검사를 진행하여 다른 장기에 전이가 없는지를 확인하게 됩니다. 따라서, 미리 걱정하시기보다는 병원에서 알려주신 추후 일정에 잘 따르시는 것을 권유드립니다. 만약 너무 궁금증과 걱정이 크시다면 3일 후 병원에 방문했을 때 전이에 대한 평가에 대해서 담당의사선생님께 질문하여 궁금증을 해소하시는 것을 추천드립니다.","['유방암', '전이', '증상', '전이', '위치', '림프절', '장기', '전이', '확인', '추가', '정밀', '검사', '필요', '유방암', '병기', '전이', '여부', '조직', '병리학', '검사', '영상', '의학', '검사', '추가', '검사', '결과', '통합', '결정', '일반', '유방암수술', '전반', '검사', '진행', '장기', '확인', '걱정', '병원', '추후', '일정', '권유', '궁금증', '걱정', '병원', '방문', '전이', '평가', '담당의사선생님', '질문', '궁금증', '해소', '추천']"
2067,"2. 결론적으로 말씀드리면, 재발에 있어 원발암 부위 국소 재발이 가장 흔하지만, 환자 특성, 재발 위치, 시간에 따라 그 치료 성적이 달라질 수 있습니다. 적극적인 치료 이후 수 년 안에 재발 가능성이 있지만, 주기적인 추적관찰(약 5년 이상)을 통해 조기 발견 및 치료를 할 수 있으므로 검사 계획에 잘 따르시는 것이 중요합니다. 유방암은 완치율이 90%에 이르는 비교적 예후가 좋은 암이지만, 암세포의 성장속도가 느린 경우 10년 후에도 재발 또는 전이될 수 있습니다. 한국유방암학회 연구에 따르면 유방암 재발률은 20~30%, 재발한 환자의 70.9%가 수술 후 3년 내 재발하며 92%는 수술 후 5년 내 재발한다고 밝혔습니다. 또한 수술 후 재발까지의 기간이 길면 길수록 재발 후 생존율 또한 높아진다고 알려져 있습니다. 따라서 수술 후 2~3년 동안 재발 위험이 가장 높으므로 지속적으로 재발을 방지하기 위한 관리 및 추적검사를 받고 적절한 약물 치료를 병행하는 것이 중요합니다.","['결론', '말씀', '재발', '원발', '부위', '국소', '재발', '환자', '특성', '재발', '위치', '시간', '치료', '성적', '적극', '치료', '이후', '재발', '가능', '주기', '추적', '관찰', '이상', '조기', '발견', '치료', '검사', '계획', '중요', '유방암', '완치', '비교', '예후', '암세포', '성장', '속도', '경우', '재발', '한국', '유방암', '학회', '연구', '유방암', '재발', '재발', '환자', '수술', '재발', '수술', '재발', '수술', '재발', '기간', '재발', '생존', '수술', '동안', '재발', '위험', '지속', '재발', '방지', '관리', '추적', '검사', '약물', '치료', '병행', '중요']"
2073,질문자님의 갈비뼈 통증과 배가 더부룩한 느낌은 유방암 전이 이외에도 다양한 원인에 의해 발생할 수 있습니다. 따라서 이 부분에 대해서는 담당의사선생님과 상의하여 그 원인을 정확하게 파악하고 완화할 수 있는 방법을 찾는 것이 중요할 것입니다.,"['질문자', '갈비뼈', '통증', '느낌', '유방암', '전이', '이외', '다양', '원인', '발생', '부분', '담당의사선생님', '상의', '원인', '정확', '파악', '완화', '방법', '중요']"
2084,"또한 체계적문헌고찰 결과, 버제니오(abemaciclib)의 조기유방암 예방효과를 본 환자군들 중 2cm 미만의 종양(tumor)을 갖고 있는 유방암 환자군 역시 대상자로 포함이 되어 있는 것을 확인할 수 있었습니다. 질문자님께서 말씀하셨던 버제니오(abemaciclib) 투약 기준인 “림프절 전이가 4개 이상” 이거나 “림프절 전이는 1-3개이나, 종양(tumor) 크기가 5cm 이상”인 환자군에서 유의한 효과를 보였으나, 이와 같은 효과는 종양(tumor) 크기가 5cm 이하인 환자군에게도 동일하게 나타났음 확인할 수 있었습니다.","['체계적문헌고찰', '결과', '버제니오', '조기', '유방암', '예방', '효과', '환자', '미만', '종양', '유방암', '환자', '대상자', '포함', '확인', '질문자', '말씀', '버제니오', '투약', '기준', '림프절', '이상', '림프절', '종양', '크기', '이상', '환자', '유의', '효과', '효과', '종양', '크기', '이하', '환자', '동일', '확인']"
2087,"전체 항호르몬제를 투여하는 환자분들 중 항호르몬제 부작용으로 인해 투약을 중단하는 비율은 약 20%에 해당합니다. 항호르몬제를 조기에 중단하는 경우, 지속적으로 복용하는 것과 비교하여 유방암의 재발 위험이 높아질 수 있습니다. 하지만, 아리미덱스를 중단하더라도 다른 항호르몬 요법 약제로 바꾸어 복용하는 방법이 있습니다. 따라서, 관련하여 주치의선생님께 항호르몬제 복용 상황에 대해서 충분히 설명한 뒤에 부작용이 더 적은 약제로 변경하여 투약할 수 있는지 상담해보시는 것을 추천드립니다.","['전체', '호르몬제', '투여', '환자', '호르몬제', '부작용', '투약', '중단', '비율', '해당', '호르몬제', '조기', '중단', '경우', '지속', '복용', '비교', '유방암', '재발', '위험', '아리미덱스', '중단', '호르몬', '요법', '약제', '복용', '방법', '관련', '주치의', '선생', '호르몬제', '복용', '상황', '설명', '부작용', '약제', '변경', '투약', '상담', '추천']"
2089,"임신 중에 유방암을 진단받아 더 속상하시고 걱정되실 것 같습니다. 질문하신 태아와 항암제의 관계에 있어서 미국종합암네트워크 가이드라인(NCCN guideline)은 독소루비신(doxorubicin), 사이클로포스파미드(cyclophosphamide), 플루오로우라실(Fluorouracil)의 항암제는 태아에게 영향을 미치지 않는다고 밝혔습니다. 따라서 말씀하신 치료계획에 따라 수술 후 위 항암제를 사용한 항암화학요법은 가능합니다.","['임신', '유방암', '진단', '걱정', '질문', '태아', '항암제', '관계', '미국', '종합', '네트워크', '가이드라인', '독소루비신', '사이클로포스파미드', '플루오로우라실', '항암제', '태아', '영향', '말씀', '치료계획', '수술', '항암제', '사용', '항암화학요법', '가능']"
2091,"결론부터 말씀드리자면, 암세포 크기 외에 림프절 전이 여부, 다른 장기로의 전이 여부, 또는 치료방법과 효과에 따라 상태 변화의 차이가 있을 수 있기 때문에 말씀 주신 정보만으로 답변을 드리지 못하는 점 양해 부탁드립니다. 따라서 본 답변에서는 병기를 결정하는 기준과 유방암 4기와 말기의 차이점에 대해 설명드리도록 하겠습니다.
 
병기는 암의 진행 상태를 평가할 수 있는 중요한 척도입니다. 유방암의 병기는 0기에서 4기까지로 분류하며, 숫자가 증가할수록 암이 더욱 진행되었음을 의미합니다. 병기를 결정할 때에는 전 세계적으로 사용하는 분류 기준인 TNM 분류법을 사용하게 됩니다.","['결론', '말씀', '암세포', '크기', '림프절', '전이', '여부', '장기', '전이', '여부', '치료방법', '효과', '상태', '변화', '차이', '때문', '말씀', '정보', '답변', '양해', '부탁', '답변', '병기', '결정', '기준', '유방암', '기와', '말기', '차이점', '설명', '병기', '진행', '상태', '평가', '중요', '척도', '유방암', '병기', '분류', '숫자', '증가', '진행', '의미', '병기', '결정', '세계', '사용', '분류', '기준', '분류법', '사용']"
2104,"일부 연구에서는 유방암 재발을 예측하는 데 도움이 되는 유전자 테스트인 온코타입 검사(Oncotype Dx)를 진행하여 항암화학요법의 필요성 여부를 확인하였습니다. 0에서 100 사이의 유방암 재발 점수 기준으로 10점 이하인 경우 항암화학요법이 필요하지 않지만, 25점 이상인 경우 항암화학요법이 도움이 됨을 말하고 있었습니다. 미국 암학회에서는 본 검사를 통해 약 2% 정도의 여성들이 항암화학요법을 하지 않아도 된다고 말하고 있었는데, 재발 점수가 0~10 사이인 모든 나이, 재발 점수가 11~15 사이인 50세 이하, 재발 점수가 11~25점인 50세 이상의 경우가 이에 해당합니다.","['일부', '연구', '유방암', '재발', '예측', '도움', '유전자', '테스트', '온코타입', '검사', '진행', '항암화학요법', '필요', '여부', '확인', '사이', '유방암', '재발', '점수', '기준', '이하', '경우', '항암화학요법', '필요', '이상', '경우', '항암화학요법', '도움', '미국', '학회', '검사', '정도', '여성', '항암화학요법', '재발', '점수', '사이', '나이', '재발', '점수', '사이', '이하', '재발', '점수', '이상', '경우', '해당']"
2110,"삼중음성유방암일 경우 기본적으로 수술과 항암화학요법을 하게 되며 이후 혹여나 남아있을 수 있는 암세포 제거 또는 재발 예방을 위해 방사선치료를 고려할 수 있습니다. 일반적으로 삼중음성유방암은 예후가 좋지 않다고 알려져 있지만, 이는 조직학적 성질에 따라 차이가 있을 수 있으니 정확한 내용은 현재 상태를 가장 잘 알고 계신 담당의사선생님과의 면담을 통해 설명 들으시는 것을 권해드립니다.","['삼중', '음성', '유방암', '경우', '기본', '수술', '항암화학요법', '이후', '암세포', '제거', '재발', '예방', '방사선치료', '고려', '일반', '삼중', '음성', '유방암', '예후', '조직학', '성질', '차이', '정확', '내용', '상태', '담당의사선생님', '면담', '설명']"
2119,"유방촬영술은 쉽게 말해 유방 조직을 찍는 엑스레이입니다. 흔히 맘모, 맘모그램 등의 용어로도 불려져요. 유방촬영술은 유방조직에 생긴 병변을 찾는 검사로 주로 혹이나 석회화를 찾을 수 있고, 유방암 증상이 없는 조기에 암을 발견하기 위해서도 시행합니다.","['유방촬영술', '유방', '조직', '엑스레이', '맘모', '맘모', '그램', '용어', '유방촬영술', '유방', '조직', '병변', '검사', '석회', '유방암', '증상', '조기', '발견', '시행']"
2124,"추가적으로, 졸라덱스는 주로 폐경 전 에스트로겐 수용체양성인 유방암 환자에게 투여하며 단독으로 투여하거나, 선택적 에스트로겐수용체조절제, 아로마타제억제제와 함께 투여하기도 합니다. 유방암의 항호르몬요법 목적으로 투여되는 경우는 일반적으로 4주(28일) 주기로 투여가 되고 최대 5년까지 투여가 가능하며 보험적용이 가능합니다. 개인의 상황에 따라 조금씩 달라질 수 있기 때문에 더욱 구체적인 사항은 담당의사선생님과 상의하시는 것을 추천드립니다.","['추가', '졸라덱스', '폐경', '에스트로겐', '수용체양성', '유방암', '환자', '투여', '단독', '투여', '선택', '에스트로겐수용체조절제', '아로마타제억제제', '투여', '유방암', '호르몬', '요법', '목적', '투여', '경우', '일반', '투여', '최대', '투여', '가능', '보험', '적용', '가능', '개인', '상황', '조금', '때문', '구체', '사항', '담당의사선생님', '상의', '추천']"
